{
  "format": "gloss-sync-project",
  "version": 2,
  "kind": "menu",
  "subjectId": "main",
  "documents": [
    {
      "kind": "menu",
      "id": "main",
      "json": "{\"components\":[],\"followPlayer\":true}"
    }
  ],
  "images": [],
  "constraints": {
    "subjectId": "main",
    "menuIds": [
      "main"
    ],
    "imagePaths": [],
    "newImagePrefix": "sync/menus/main/",
    "allowDeletes": false
  },
  "warnings": [],
  "baseRevision": "sha256:78afcaf40bb43e61baf39872f21410eca7abe59cf21ea8dcc3c7768e9ab4313a"
}
