{
  "format": "gloss-sync-project",
  "version": 2,
  "kind": "panel",
  "subjectId": "main",
  "documents": [
    {
      "kind": "menu",
      "id": "main/menu",
      "json": "{\"components\":[]}"
    },
    {
      "kind": "panel",
      "id": "main",
      "json": "{\"follow\":{\"mode\":\"none\",\"rotation\":\"fixed\",\"targetPlayerUuid\":null},\"id\":\"main\",\"revision\":1,\"rootMenuId\":\"main/menu\",\"schemaVersion\":1,\"transform\":{\"pitch\":1,\"roll\":1,\"scale\":1,\"worldKey\":\"minecraft:overworld\",\"worldUuid\":\"00000000-0000-4000-8000-000000000043\",\"x\":100000000000000000000,\"y\":0.1,\"yaw\":0,\"z\":1e-7},\"uuid\":\"00000000-0000-4000-8000-000000000042\",\"visibility\":{\"interactPermission\":null,\"interactionRange\":8,\"mode\":\"public\",\"viewPermission\":null,\"viewRange\":64}}"
    }
  ],
  "images": [],
  "constraints": {
    "subjectId": "main",
    "menuIds": [
      "main/menu"
    ],
    "imagePaths": [],
    "newMenuPrefix": "main/",
    "newImagePrefix": "sync/main/",
    "allowDeletes": false
  },
  "warnings": [
    "Snowman ☃, CJK 雪, HTML <tag>&, quote \" and slash \\, control \b\t\n\f\r, separators   , emoji 🚀"
  ],
  "baseRevision": "sha256:b2c3b016d1928a2079f16d0db299722de3e50a4ee7a31f9ba4d2062322574d05"
}
